{
  "schema_version": "1",
  "declaration_id": "mpd-v1-99c6adc72099ab3f3ad6aaa070f50fb8916b77dc13fa0f70940f61805364572a",
  "record_kind": "synthetic_example",
  "assertion_basis": "synthetic_example_not_a_maintainer_assertion",
  "repository": "synthetic/maintainer-policy-declaration-demo",
  "repository_url": "https://example.invalid/synthetic/maintainer-policy-declaration-demo",
  "commit_sha": "0123456789abcdef0123456789abcdef01234567",
  "policy_source_url": "https://example.invalid/synthetic/maintainer-policy-declaration-demo/blob/0123456789abcdef0123456789abcdef01234567/CONTRIBUTING.md",
  "policy_path": "CONTRIBUTING.md",
  "source_sha256": "1234567890abcdef1234567890abcdef1234567890abcdef1234567890abcdef",
  "observed_at": "2026-08-10",
  "dimensions": {
    "ai_assisted_code": "not_declared",
    "ai_assisted_documentation": "not_declared",
    "ai_authored_issue_text": "not_declared",
    "ai_authored_pr_text": "not_declared",
    "autonomous_issue_submission": "not_declared",
    "autonomous_pr_submission": "not_declared",
    "automated_review_comments": "not_declared",
    "good_first_issue_automation": "not_declared",
    "security_report_automation": "not_declared",
    "disclosure": "not_declared",
    "human_review": "not_declared",
    "human_accountability": "not_declared",
    "license_ip_checks": "not_declared"
  },
  "disclosure_location": "not_declared",
  "enforcement": "not_declared",
  "supersedes": null,
  "notes": "Reserved synthetic namespace example only; no existence, identity, or authority assertion."
}
